{
  "box": {
    "width": "@theme/metric.dialog.width",
    "height": "@theme/metric.dialog.height",
    "padding": "@theme/metric.spacing.lg",
    "justifyContent": "flex_end"
  },
  "layers": [
    {
      "op": "shadow",
      "id": "shadow",
      "fill": "@theme/color.common.shadow",
      "feather": "@theme/metric.shadow.feather",
      "radius": "@theme/metric.shadow.radius",
      "offset": [
        "@theme/metric.shadow.offsetX",
        "@theme/metric.shadow.offsetY"
      ],
      "spread": "@theme/metric.shadow.spread"
    },
    {
      "op": "rect",
      "id": "panel",
      "fill": "@theme/color.surface.raised",
      "stroke": "@theme/color/border.subtle",
      "strokeWidth": 1,
      "radius": 14
    },
    {
      "op": "text",
      "id": "title",
      "data_id": "title",
      "color": "@theme/color.text.primary",
      "fontSize": "@theme/metric.font.size.title",
      "align": "left",
      "valign": "top",
      "inset": [
        16,
        20,
        0,
        20
      ],
      "height": 0
    },
    {
      "op": "text",
      "id": "text",
      "data_id": "text",
      "color": "@theme/color.text.dim",
      "fontSize": "@theme/metric.font.size.md",
      "align": "left",
      "valign": "top",
      "inset": [
        52,
        20,
        0,
        20
      ]
    }
  ],
  "states": {
    "open": {
      "panel.opacity": {
        "to": 1,
        "duration": 160,
        "easing": "quadraticOut"
      },
      "panel.offsetY": {
        "to": 0,
        "duration": 160,
        "easing": "quadraticOut"
      }
    },
    "closed": {
      "panel.opacity": {
        "to": 0,
        "duration": 140
      },
      "panel.offsetY": {
        "to": 24,
        "duration": 140
      }
    }
  },
  "import": "base/glass_surface"
}
